{
  "repo_id": "bitwikiorg/simple_thinking_tool",
  "source_sha": "2609fe5979e7d4e62024b2be103e81ee9230c172",
  "version_path": "repos/bitwikiorg/simple_thinking_tool/versions/2609fe5979e7d4e62024b2be103e81ee9230c172/",
  "manifest_uri": "https://raw.githubusercontent.com/bitwikiorg/atlas/main/repos/bitwikiorg/simple_thinking_tool/versions/2609fe5979e7d4e62024b2be103e81ee9230c172/manifest.json",
  "published_at": "2026-08-16T15:07:47.494Z",
  "template_id": "base",
  "github_docs_url": "https://github.com/bitwikiorg/atlas/tree/main/repos/bitwikiorg/simple_thinking_tool/versions/2609fe5979e7d4e62024b2be103e81ee9230c172"
}
